<?xml version="1.0" encoding="UTF-8"?>
<!DOCTYPE html PUBLIC "-//WAPFORUM//DTD XHTML Mobile 1.0//EN" "wink_doc.dtd" >
<?xml-stylesheet type="text/xsl" href="wink_doc.xsl"?>
<module>
  <title>title</title>
  <name>name</name>
  <is_graphical>is_graphical</is_graphical>
  <description>description</description>
  <test_pages>
    <page>
      <description>description</description>
      <url>url</url>
    </page>
  </test_pages>
  <compatibility>compatibility</compatibility>
  <dependencies>
    <dependency>
      <module_name>module_name</module_name>
    </dependency>
  </dependencies>
  <instanciation>
    <description>description</description>
    <properties>
      <property>
        <name>name</name>
        <description>description</description>
        <type>type</type>
        <is_optional>is_optional</is_optional>
      </property>
    </properties>
    <code_sample>code_sample</code_sample>
  </instanciation>
  <components>
    <component>
      <name>name</name>
      <description>description</description>
      <public_methods>
        <method>
          <name>name</name>
          <description>description</description>
          <parameters>
            <parameter>
              <name>name</name>
              <description>description</description>
              <type>type</type>
              <is_optional>is_optional</is_optional>
            </parameter>
          </parameters>
        </method>
      </public_methods>
      <public_properties>
        <property>
          <name>name</name>
          <description>description</description>
          <type>type</type>
          <is_optional>is_optional</is_optional>
        </property>
      </public_properties>
      <events>
        <event>
          <name>name</name>
          <description>description</description>
          <return>
            <property>
              <name>name</name>
              <description>description</description>
              <type>type</type>
              <is_optional>is_optional</is_optional>
            </property>
          </return>
        </event>
      </events>
    </component>
  </components>
  <styles>
    <classes>
      <class>
        <name>name</name>
        <description>description</description>
      </class>
    </classes>
  </styles>
</module>
